{
  "id": "score_helpful_1",
  "project_id": "proj_demo",
  "subject_type": "trace",
  "subject_id": "9b7c1e2d3a4b5c6d7e8f90a1b2c3d4e5",
  "name": "helpfulness",
  "data_type": "numeric",
  "value_numeric": 0.9,
  "value_string": null,
  "source": "llm_judge",
  "config_ref": { "type": "score_config", "id": "cfg_helpfulness", "label": "helpfulness (0-1)" },
  "comment": "clear and correct",
  "metadata": { "judge_model": "gpt-4o" },
  "timestamp": "2026-07-09T10:00:06.000Z",
  "environment": "production"
}
